{
  "timestamp": "2025-10-01T10:13:15.716Z",
  "orderId": "0f77cfd1-c4ec-4e5f-8262-d9de2add939a",
  "orderUpdateId": 2,
  "nodes": [
    {
      "id": "SVR3QA0022",
      "linkedEdges": [
        "SVR3QA0022-1"
      ]
    },
    {
      "id": "1",
      "linkedEdges": [
        "SVR3QA0022-1",
        "1-SVR3QA2098"
      ],
      "action": {
        "id": "9b636a73-5591-4bc7-95d3-26d33fe07491",
        "type": "TURN",
        "metadata": {
          "direction": "LEFT"
        }
      }
    },
    {
      "id": "SVR3QA2098",
      "linkedEdges": [
        "1-SVR3QA2098"
      ],
      "action": {
        "type": "DOCK",
        "id": "22efe65d-caab-4cbf-98a6-0965eda5b2ad",
        "metadata": {
          "loadId": "04fa8cca341290",
          "loadType": "RED",
          "loadPosition": "1"
        }
      }
    }
  ],
  "edges": [
    {
      "id": "SVR3QA0022-1",
      "length": 380,
      "linkedNodes": [
        "SVR3QA0022",
        "1"
      ]
    },
    {
      "id": "1-SVR3QA2098",
      "length": 380,
      "linkedNodes": [
        "1",
        "SVR3QA2098"
      ]
    }
  ],
  "serialNumber": "5iO4"
}